FBgn_ID,Gene_Symbol,Summary
FBgn0261808,cu,"curled (cu) encodes a NADP/NADPH phosphatase. It is involved in NADP metabolism, mRNA poly(A) tail shortening and response to light. cu mutants has wings curved upward."
FBgn0261854,aPKC,"atypical protein kinase C (aPKC) encodes a member of the conserved Par complex and is asymmetrically localized to the apical cortex, where it phosphorylates and thus excludes the basal determinants encoded by mira and numb. It is involved in neuroblast proliferation and self-renewal."
FBgn0263397,Ih,"I[[h]] channel (Ih) encodes a low-threshold, voltage-gated ion channel. It may influence excitatory postsynaptic potential kinetics and integration."
FBgn0264273,Sema2b,"Semaphorin 2b (Sema2b) encodes a member of the Semaphorins family, which are membrane and secreted short-range signaling proteins. The product of Sema2b contributes to the regulation of axon and dendrite guidance as well as cell-matrix adhesion."
FBgn0264922,Sumo,"Small ubiquitin like modifier (Sumo) encodes the only Drosophila SUMO family protein. It is required for embryonic patterning and mitosis. It may also have roles in wing patterning, Dpp signaling, and Ras/MAPK signaling. It localizes to the nucleus during interphase  and to the kinetochores and midbodies during mitosis."
FBgn0265991,Zasp52,"Z band alternatively spliced PDZ-motif protein 52 (Zasp52) encodes a member of the Zasp protein family. It is a scaffold protein that binds the product of Actn and localizes to muscle attachment sites and Z-discs in muscle cells, as well as localizing cortically in non-muscle cells. It plays a role in muscle development, especially in myofibril assembly."
FBgn0267001,Ten-a,"Tenascin accessory (Ten-a) encodes a type II dimeric transmembrane protein with a  extracellular domain that mediates homophilic interactions with itself and with the product of Ten-m. It also interacts intracellularly with cytoskeleton regulatory proteins. It regulates axon guidance in embryonic nervous system, synaptic partner matching as well as synaptic organization in olfactory and neuromuscular systems."
FBgn0267487,Ptp61F,"Protein tyrosine phosphatase 61F (Ptp61F) encodes a non-receptor protein tyrosine phosphatase. It is known to act as a negative regulator of various kinase-dependent signalling pathways, including the JAK-STAT, Insulin-like Receptor, EGFR, and Pvr pathways in a wide variety of contexts."
FBgn0283521,lola,"longitudinals lacking (lola) encodes a protein involved in Notch signaling, cell death, regulation of retrotransposons and expression of axon and dendrite patterning genes. It contributes to oogenesis, spermatogenesis, neural wiring, eye development and a variety of behaviors."
FBgn0284084,wg,"wingless (wg) is a segment polarity gene that encodes a ligand of the Wnt/Wg signaling pathway. Its post-translational modification (addition of palmitoleate by the product of por) is essential for signaling activity. It contributes to segment polarity, tissue growth and patterning, neuromuscular junction morphogenesis, gut homeostasis and long term memory formation."
FBgn0284256,bsf,"bicoid stability factor (bsf) encodes a member of the family of proteins containing the pentatricopeptide motif, an RNA binding domain. It is found in the cytoplasm, where it functions in mRNA stability and post-transcriptional control of gene expression, and in mitochondria, where it has multiple roles in gene expression. It acts at many stages of development, and is required for progression through oogenesis and viability."
